,subtitleNullable,creatorNameNullable,creatorUrlNullable,totalBytesNullable,urlNullable,licenseNameNullable,descriptionNullable,ownerNameNullable,ownerRefNullable,titleNullable,currentVersionNumberNullable,usabilityRatingNullable,id,ref,subtitle,hasSubtitle,creatorName,hasCreatorName,creatorUrl,hasCreatorUrl,totalBytes,hasTotalBytes,url,hasUrl,lastUpdated,downloadCount,isPrivate,isFeatured,licenseName,hasLicenseName,description,hasDescription,ownerName,hasOwnerName,ownerRef,hasOwnerRef,kernelCount,title,hasTitle,topicCount,viewCount,voteCount,currentVersionNumber,hasCurrentVersionNumber,usabilityRating,hasUsabilityRating,tags,files,versions
67,Dataset about the most updated asteroids along with their updated features ,Victor Basu,basu369victor,168550520.0,https://www.kaggle.com/datasets/basu369victor/prediction-of-asteroid-diameter,CC0: Public Domain,,Victor Basu,basu369victor,Open Asteroid Dataset,5,1.0,408523,basu369victor/prediction-of-asteroid-diameter,Dataset about the most updated asteroids along with their updated features ,True,Victor Basu,True,basu369victor,True,168550520,True,https://www.kaggle.com/datasets/basu369victor/prediction-of-asteroid-diameter,True,2019-12-12T18:48:52.997Z,3967,False,False,CC0: Public Domain,True,,False,Victor Basu,True,basu369victor,True,22,Open Asteroid Dataset,True,0,58685,143,5,True,1.0,True,"[{'nameNullable': 'earth and nature', 'descriptionNullable': None, 'fullPathNullable': 'subject > earth and nature', 'ref': 'earth and nature', 'name': 'earth and nature', 'hasName': True, 'description': '', 'hasDescription': False, 'fullPath': 'subject > earth and nature', 'hasFullPath': True, 'competitionCount': 11, 'datasetCount': 58697, 'scriptCount': 356, 'totalCount': 59064}, {'nameNullable': 'astronomy', 'descriptionNullable': ""There are lots of fun datasets here for you to analyze, and who knows, maybe you'll find a habitable planet hidden in the data that no one else saw. Then you could have a planet named after you!"", 'fullPathNullable': 'subject > earth and nature > physical science > astronomy', 'ref': 'astronomy', 'name': 'astronomy', 'hasName': True, 'description': ""There are lots of fun datasets here for you to analyze, and who knows, maybe you'll find a habitable planet hidden in the data that no one else saw. Then you could have a planet named after you!"", 'hasDescription': True, 'fullPath': 'subject > earth and nature > physical science > astronomy', 'hasFullPath': True, 'competitionCount': 11, 'datasetCount': 1551, 'scriptCount': 970, 'totalCount': 2532}, {'nameNullable': 'computer science', 'descriptionNullable': 'There is one thing we can say for sure about computer science: Computer science leads to more computer games which leads to better GPUs which leads to smarter AI.', 'fullPathNullable': 'subject > science and technology > computer science', 'ref': 'computer science', 'name': 'computer science', 'hasName': True, 'description': 'There is one thing we can say for sure about computer science: Computer science leads to more computer games which leads to better GPUs which leads to smarter AI.', 'hasDescription': True, 'fullPath': 'subject > science and technology > computer science', 'hasFullPath': True, 'competitionCount': 7, 'datasetCount': 45261, 'scriptCount': 598, 'totalCount': 45866}, {'nameNullable': 'exploratory data analysis', 'descriptionNullable': None, 'fullPathNullable': 'technique > exploratory data analysis', 'ref': 'exploratory data analysis', 'name': 'exploratory data analysis', 'hasName': True, 'description': '', 'hasDescription': False, 'fullPath': 'technique > exploratory data analysis', 'hasFullPath': True, 'competitionCount': 14, 'datasetCount': 4812, 'scriptCount': 32037, 'totalCount': 36863}]",[],[]
68,Multi Label Classification using NLP on Research Articles ,Vetrivel-PS,vetrirah,12001191.0,https://www.kaggle.com/datasets/vetrirah/janatahack-independence-day-2020-ml-hackathon,CC0: Public Domain,,Vetrivel-PS,vetrirah,NLP on Research Articles,1,1.0,837691,vetrirah/janatahack-independence-day-2020-ml-hackathon,Multi Label Classification using NLP on Research Articles ,True,Vetrivel-PS,True,vetrirah,True,12001191,True,https://www.kaggle.com/datasets/vetrirah/janatahack-independence-day-2020-ml-hackathon,True,2020-08-19T14:35:13.817Z,1717,False,False,CC0: Public Domain,True,,False,Vetrivel-PS,True,vetrirah,True,7,NLP on Research Articles,True,0,16501,39,1,True,1.0,True,"[{'nameNullable': 'earth and nature', 'descriptionNullable': None, 'fullPathNullable': 'subject > earth and nature', 'ref': 'earth and nature', 'name': 'earth and nature', 'hasName': True, 'description': '', 'hasDescription': False, 'fullPath': 'subject > earth and nature', 'hasFullPath': True, 'competitionCount': 11, 'datasetCount': 58697, 'scriptCount': 356, 'totalCount': 59064}, {'nameNullable': 'business', 'descriptionNullable': 'Businesses are organizational entities that drive economic activity. Explore the inner workings of things like HR practices, product sales, and customer happiness in these competitions, kernels, and datasets.', 'fullPathNullable': 'subject > people and society > business', 'ref': 'business', 'name': 'business', 'hasName': True, 'description': 'Businesses are organizational entities that drive economic activity. Explore the inner workings of things like HR practices, product sales, and customer happiness in these competitions, kernels, and datasets.', 'hasDescription': True, 'fullPath': 'subject > people and society > business', 'hasFullPath': True, 'competitionCount': 33, 'datasetCount': 92487, 'scriptCount': 25484, 'totalCount': 118004}, {'nameNullable': 'science and technology', 'descriptionNullable': None, 'fullPathNullable': 'subject > science and technology', 'ref': 'science and technology', 'name': 'science and technology', 'hasName': True, 'description': '', 'hasDescription': False, 'fullPath': 'subject > science and technology', 'hasFullPath': True, 'competitionCount': 7, 'datasetCount': 3560, 'scriptCount': 1567, 'totalCount': 5134}, {'nameNullable': 'computer science', 'descriptionNullable': 'There is one thing we can say for sure about computer science: Computer science leads to more computer games which leads to better GPUs which leads to smarter AI.', 'fullPathNullable': 'subject > science and technology > computer science', 'ref': 'computer science', 'name': 'computer science', 'hasName': True, 'description': 'There is one thing we can say for sure about computer science: Computer science leads to more computer games which leads to better GPUs which leads to smarter AI.', 'hasDescription': True, 'fullPath': 'subject > science and technology > computer science', 'hasFullPath': True, 'competitionCount': 7, 'datasetCount': 45261, 'scriptCount': 598, 'totalCount': 45866}, {'nameNullable': 'tpu', 'descriptionNullable': 'A powerful computer chip built specifically for accelerating machine learning workloads in a fast and scalable manner. It is designed to massively parallelize ML tasks that would not normally fit on GPU.', 'fullPathNullable': 'subject > science and technology > computer science > accelerators > tpu', 'ref': 'tpu', 'name': 'tpu', 'hasName': True, 'description': 'A powerful computer chip built specifically for accelerating machine learning workloads in a fast and scalable manner. It is designed to massively parallelize ML tasks that would not normally fit on GPU.', 'hasDescription': True, 'fullPath': 'subject > science and technology > computer science > accelerators > tpu', 'hasFullPath': True, 'competitionCount': 3, 'datasetCount': 75, 'scriptCount': 70177, 'totalCount': 70255}, {'nameNullable': 'gpu', 'descriptionNullable': 'A generalized processor that excels at small-to-medium-scale matrix operations. It is traditionally used for training machine learning models on very large datasets.', 'fullPathNullable': 'subject > science and technology > computer science > accelerators > gpu', 'ref': 'gpu', 'name': 'gpu', 'hasName': True, 'description': 'A generalized processor that excels at small-to-medium-scale matrix operations. It is traditionally used for training machine learning models on very large datasets.', 'hasDescription': True, 'fullPath': 'subject > science and technology > computer science > accelerators > gpu', 'hasFullPath': True, 'competitionCount': 2, 'datasetCount': 189, 'scriptCount': 4402649, 'totalCount': 4402840}]",[],[]
69,Citation network between computer science papers on ArXiv (directed),Redao da Taupl,dataup1,169289809.0,https://www.kaggle.com/datasets/dataup1/ogbn-arxiv,ODC Attribution License (ODC-By),,Redao da Taupl,dataup1,OGBN-ArXiv (Processed for PyG),2,0.7647059,1162365,dataup1/ogbn-arxiv,Citation network between computer science papers on ArXiv (directed),True,Redao da Taupl,True,dataup1,True,169289809,True,https://www.kaggle.com/datasets/dataup1/ogbn-arxiv,True,2021-02-27T07:32:02.113Z,335,False,False,ODC Attribution License (ODC-By),True,,False,Redao da Taupl,True,dataup1,True,4,OGBN-ArXiv (Processed for PyG),True,0,6383,6,2,True,0.7647059,True,"[{'nameNullable': 'education', 'descriptionNullable': 'Education datasets and kernels relate to statistics on student performance, university rankings, and answers for all your homework questions.', 'fullPathNullable': 'subject > people and society > education', 'ref': 'education', 'name': 'education', 'hasName': True, 'description': 'Education datasets and kernels relate to statistics on student performance, university rankings, and answers for all your homework questions.', 'hasDescription': True, 'fullPath': 'subject > people and society > education', 'hasFullPath': True, 'competitionCount': 37, 'datasetCount': 28789, 'scriptCount': 14937, 'totalCount': 43763}, {'nameNullable': 'computer science', 'descriptionNullable': 'There is one thing we can say for sure about computer science: Computer science leads to more computer games which leads to better GPUs which leads to smarter AI.', 'fullPathNullable': 'subject > science and technology > computer science', 'ref': 'computer science', 'name': 'computer science', 'hasName': True, 'description': 'There is one thing we can say for sure about computer science: Computer science leads to more computer games which leads to better GPUs which leads to smarter AI.', 'hasDescription': True, 'fullPath': 'subject > science and technology > computer science', 'hasFullPath': True, 'competitionCount': 7, 'datasetCount': 45261, 'scriptCount': 598, 'totalCount': 45866}, {'nameNullable': 'programming', 'descriptionNullable': 'The programming tag contains datsets and kernels from coder surveys, revision histories, and bug triaging.', 'fullPathNullable': 'subject > science and technology > computer science > programming', 'ref': 'programming', 'name': 'programming', 'hasName': True, 'description': 'The programming tag contains datsets and kernels from coder surveys, revision histories, and bug triaging.', 'hasDescription': True, 'fullPath': 'subject > science and technology > computer science > programming', 'hasFullPath': True, 'competitionCount': 1, 'datasetCount': 11479, 'scriptCount': 83455, 'totalCount': 94935}, {'nameNullable': 'classification', 'descriptionNullable': None, 'fullPathNullable': 'task > classification', 'ref': 'classification', 'name': 'classification', 'hasName': True, 'description': '', 'hasDescription': False, 'fullPath': 'task > classification', 'hasFullPath': True, 'competitionCount': 127, 'datasetCount': 5199, 'scriptCount': 19229, 'totalCount': 24555}, {'nameNullable': 'multiclass classification', 'descriptionNullable': None, 'fullPathNullable': 'task > multiclass classification', 'ref': 'multiclass classification', 'name': 'multiclass classification', 'hasName': True, 'description': '', 'hasDescription': False, 'fullPath': 'task > multiclass classification', 'hasFullPath': True, 'competitionCount': 666, 'datasetCount': 1324, 'scriptCount': 3693, 'totalCount': 5683}, {'nameNullable': 'pre-trained model', 'descriptionNullable': '', 'fullPathNullable': 'admin > pre-trained model', 'ref': 'pre-trained model', 'name': 'pre-trained model', 'hasName': True, 'description': '', 'hasDescription': True, 'fullPath': 'admin > pre-trained model', 'hasFullPath': True, 'competitionCount': 1, 'datasetCount': 245457, 'scriptCount': 302, 'totalCount': 245760}]",[],[]
70,NLP Topic Modelling based on Research Articles.,Blesson Densil,blessondensil294,11978949.0,https://www.kaggle.com/datasets/blessondensil294/topic-modeling-for-research-articles,"Database: Open Database, Contents: Database Contents",,Blesson Densil,blessondensil294,Topic Modeling for Research Articles,1,1.0,836238,blessondensil294/topic-modeling-for-research-articles,NLP Topic Modelling based on Research Articles.,True,Blesson Densil,True,blessondensil294,True,11978949,True,https://www.kaggle.com/datasets/blessondensil294/topic-modeling-for-research-articles,True,2020-08-18T08:53:26.513Z,3126,False,False,"Database: Open Database, Contents: Database Contents",True,,False,Blesson Densil,True,blessondensil294,True,19,Topic Modeling for Research Articles,True,0,29146,50,1,True,1.0,True,"[{'nameNullable': 'research', 'descriptionNullable': ""Research is our endeavor to systematically increase our knowledge about the world. Whether it's undertaken by greats like Einstein or underpaid graduate students, you'll find the fruits of their labor in this tag plus the kernels that make their work reproducible."", 'fullPathNullable': 'subject > science and technology > research', 'ref': 'research', 'name': 'research', 'hasName': True, 'description': ""Research is our endeavor to systematically increase our knowledge about the world. Whether it's undertaken by greats like Einstein or underpaid graduate students, you'll find the fruits of their labor in this tag plus the kernels that make their work reproducible."", 'hasDescription': True, 'fullPath': 'subject > science and technology > research', 'hasFullPath': True, 'competitionCount': 15, 'datasetCount': 953, 'scriptCount': 414, 'totalCount': 1382}, {'nameNullable': 'earth and nature', 'descriptionNullable': None, 'fullPathNullable': 'subject > earth and nature', 'ref': 'earth and nature', 'name': 'earth and nature', 'hasName': True, 'description': '', 'hasDescription': False, 'fullPath': 'subject > earth and nature', 'hasFullPath': True, 'competitionCount': 11, 'datasetCount': 58697, 'scriptCount': 356, 'totalCount': 59064}, {'nameNullable': 'biology', 'descriptionNullable': 'Explore datasets and kernels about gene expressions, transcriptomics, and even the works of Charles Darwin.', 'fullPathNullable': 'subject > earth and nature > biology', 'ref': 'biology', 'name': 'biology', 'hasName': True, 'description': 'Explore datasets and kernels about gene expressions, transcriptomics, and even the works of Charles Darwin.', 'hasDescription': True, 'fullPath': 'subject > earth and nature > biology', 'hasFullPath': True, 'competitionCount': 22, 'datasetCount': 13519, 'scriptCount': 4726, 'totalCount': 18267}, {'nameNullable': 'physics', 'descriptionNullable': 'Physics is the natural science that involves the study of matter and its motion and behavior through space and time, along with related concepts such as energy and force.', 'fullPathNullable': 'subject > earth and nature > physical science > physics', 'ref': 'physics', 'name': 'physics', 'hasName': True, 'description': 'Physics is the natural science that involves the study of matter and its motion and behavior through space and time, along with related concepts such as energy and force.', 'hasDescription': True, 'fullPath': 'subject > earth and nature > physical science > physics', 'hasFullPath': True, 'competitionCount': 16, 'datasetCount': 1140, 'scriptCount': 1056, 'totalCount': 2212}, {'nameNullable': 'education', 'descriptionNullable': 'Education datasets and kernels relate to statistics on student performance, university rankings, and answers for all your homework questions.', 'fullPathNullable': 'subject > people and society > education', 'ref': 'education', 'name': 'education', 'hasName': True, 'description': 'Education datasets and kernels relate to statistics on student performance, university rankings, and answers for all your homework questions.', 'hasDescription': True, 'fullPath': 'subject > people and society > education', 'hasFullPath': True, 'competitionCount': 37, 'datasetCount': 28789, 'scriptCount': 14937, 'totalCount': 43763}, {'nameNullable': 'psychology', 'descriptionNullable': ""Psychology is the study of how we use our brains (or don't) to interact with others. Humans are complicated and maybe data science can help us understand ourselves."", 'fullPathNullable': 'subject > people and society > social science > psychology', 'ref': 'psychology', 'name': 'psychology', 'hasName': True, 'description': ""Psychology is the study of how we use our brains (or don't) to interact with others. Humans are complicated and maybe data science can help us understand ourselves."", 'hasDescription': True, 'fullPath': 'subject > people and society > social science > psychology', 'hasFullPath': True, 'competitionCount': 1, 'datasetCount': 2638, 'scriptCount': 355, 'totalCount': 2994}, {'nameNullable': 'computer science', 'descriptionNullable': 'There is one thing we can say for sure about computer science: Computer science leads to more computer games which leads to better GPUs which leads to smarter AI.', 'fullPathNullable': 'subject > science and technology > computer science', 'ref': 'computer science', 'name': 'computer science', 'hasName': True, 'description': 'There is one thing we can say for sure about computer science: Computer science leads to more computer games which leads to better GPUs which leads to smarter AI.', 'hasDescription': True, 'fullPath': 'subject > science and technology > computer science', 'hasFullPath': True, 'competitionCount': 7, 'datasetCount': 45261, 'scriptCount': 598, 'totalCount': 45866}]",[],[]
71,Statistics for Programming Languages used on GitHub,Isaac Wen,isaacwen,41198.0,https://www.kaggle.com/datasets/isaacwen/github-programming-languages-data,Attribution 4.0 International (CC BY 4.0),,Isaac Wen,isaacwen,GitHub Programming Languages Data,1,1.0,1835260,isaacwen/github-programming-languages-data,Statistics for Programming Languages used on GitHub,True,Isaac Wen,True,isaacwen,True,41198,True,https://www.kaggle.com/datasets/isaacwen/github-programming-languages-data,True,2022-01-02T03:58:56.88Z,4098,False,False,Attribution 4.0 International (CC BY 4.0),True,,False,Isaac Wen,True,isaacwen,True,12,GitHub Programming Languages Data,True,0,27402,54,1,True,1.0,True,"[{'nameNullable': 'computer science', 'descriptionNullable': 'There is one thing we can say for sure about computer science: Computer science leads to more computer games which leads to better GPUs which leads to smarter AI.', 'fullPathNullable': 'subject > science and technology > computer science', 'ref': 'computer science', 'name': 'computer science', 'hasName': True, 'description': 'There is one thing we can say for sure about computer science: Computer science leads to more computer games which leads to better GPUs which leads to smarter AI.', 'hasDescription': True, 'fullPath': 'subject > science and technology > computer science', 'hasFullPath': True, 'competitionCount': 7, 'datasetCount': 45261, 'scriptCount': 598, 'totalCount': 45866}, {'nameNullable': 'programming', 'descriptionNullable': 'The programming tag contains datsets and kernels from coder surveys, revision histories, and bug triaging.', 'fullPathNullable': 'subject > science and technology > computer science > programming', 'ref': 'programming', 'name': 'programming', 'hasName': True, 'description': 'The programming tag contains datsets and kernels from coder surveys, revision histories, and bug triaging.', 'hasDescription': True, 'fullPath': 'subject > science and technology > computer science > programming', 'hasFullPath': True, 'competitionCount': 1, 'datasetCount': 11479, 'scriptCount': 83455, 'totalCount': 94935}, {'nameNullable': 'software', 'descriptionNullable': None, 'fullPathNullable': 'subject > science and technology > computer science > software', 'ref': 'software', 'name': 'software', 'hasName': True, 'description': '', 'hasDescription': False, 'fullPath': 'subject > science and technology > computer science > software', 'hasFullPath': True, 'competitionCount': 1, 'datasetCount': 15510, 'scriptCount': 11242, 'totalCount': 26753}, {'nameNullable': 'bigquery', 'descriptionNullable': None, 'fullPathNullable': 'data type > bigquery', 'ref': 'bigquery', 'name': 'bigquery', 'hasName': True, 'description': '', 'hasDescription': False, 'fullPath': 'data type > bigquery', 'hasFullPath': True, 'competitionCount': 2, 'datasetCount': 413, 'scriptCount': 660, 'totalCount': 1075}, {'nameNullable': 'python', 'descriptionNullable': '', 'fullPathNullable': 'subject > science and technology > computer science > programming > python', 'ref': 'python', 'name': 'python', 'hasName': True, 'description': '', 'hasDescription': True, 'fullPath': 'subject > science and technology > computer science > programming > python', 'hasFullPath': True, 'competitionCount': 8, 'datasetCount': 1371, 'scriptCount': 12279, 'totalCount': 13658}]",[],[]
72,Collection of SMS messages tagged as spam or legitimate,Esther Kim,ekim01,215934.0,https://www.kaggle.com/datasets/uciml/sms-spam-collection-dataset,Unknown,,UCI Machine Learning,organizations/uciml,SMS Spam Collection Dataset,1,0.7352941,483,uciml/sms-spam-collection-dataset,Collection of SMS messages tagged as spam or legitimate,True,Esther Kim,True,ekim01,True,215934,True,https://www.kaggle.com/datasets/uciml/sms-spam-collection-dataset,True,2016-12-02T19:29:17.523Z,244524,False,False,Unknown,True,,False,UCI Machine Learning,True,organizations/uciml,True,1436,SMS Spam Collection Dataset,True,0,997728,1567,1,True,0.7352941,True,"[{'nameNullable': 'languages', 'descriptionNullable': 'Language is a method of communication that consists of using words arranged into meaningful patterns. This is a good place to find natural language processing datasets and kernels to study languages and train your chat bots.', 'fullPathNullable': 'subject > culture and humanities > languages', 'ref': 'languages', 'name': 'languages', 'hasName': True, 'description': 'Language is a method of communication that consists of using words arranged into meaningful patterns. This is a good place to find natural language processing datasets and kernels to study languages and train your chat bots.', 'hasDescription': True, 'fullPath': 'subject > culture and humanities > languages', 'hasFullPath': True, 'competitionCount': 10, 'datasetCount': 876, 'scriptCount': 341, 'totalCount': 1227}, {'nameNullable': 'linguistics', 'descriptionNullable': 'The linguistics tag contains datasets and kernels that you can use for text analytics, sentiment analyses, and making clever jokes like this: Let me tell you a little about myself. It\'s a reflexive pronoun that means ""me.""', 'fullPathNullable': 'subject > people and society > social science > linguistics', 'ref': 'linguistics', 'name': 'linguistics', 'hasName': True, 'description': 'The linguistics tag contains datasets and kernels that you can use for text analytics, sentiment analyses, and making clever jokes like this: Let me tell you a little about myself. It\'s a reflexive pronoun that means ""me.""', 'hasDescription': True, 'fullPath': 'subject > people and society > social science > linguistics', 'hasFullPath': True, 'competitionCount': 25, 'datasetCount': 809, 'scriptCount': 187, 'totalCount': 1021}, {'nameNullable': 'email and messaging', 'descriptionNullable': None, 'fullPathNullable': 'subject > science and technology > internet > email and messaging', 'ref': 'email and messaging', 'name': 'email and messaging', 'hasName': True, 'description': '', 'hasDescription': False, 'fullPath': 'subject > science and technology > internet > email and messaging', 'hasFullPath': True, 'competitionCount': 1, 'datasetCount': 4901, 'scriptCount': 167, 'totalCount': 5069}]",[],[]
73,Computer Science articles published in WoS Journals during 2019,Jorge Chamorro Padial,jorgechamorropadial,11414847.0,https://www.kaggle.com/datasets/jorgechamorropadial/computer-science-articles-journals-2019,Data files Â© Original Authors,,Jorge Chamorro Padial,jorgechamorropadial,"Computer Science Articles & Journals, 2019",1,0.75,1268595,jorgechamorropadial/computer-science-articles-journals-2019,Computer Science articles published in WoS Journals during 2019,True,Jorge Chamorro Padial,True,jorgechamorropadial,True,11414847,True,https://www.kaggle.com/datasets/jorgechamorropadial/computer-science-articles-journals-2019,True,2021-04-13T08:13:57.673Z,43,False,False,Data files Â© Original Authors,True,,False,Jorge Chamorro Padial,True,jorgechamorropadial,True,0,"Computer Science Articles & Journals, 2019",True,0,1085,3,1,True,0.75,True,"[{'nameNullable': 'computer science', 'descriptionNullable': 'There is one thing we can say for sure about computer science: Computer science leads to more computer games which leads to better GPUs which leads to smarter AI.', 'fullPathNullable': 'subject > science and technology > computer science', 'ref': 'computer science', 'name': 'computer science', 'hasName': True, 'description': 'There is one thing we can say for sure about computer science: Computer science leads to more computer games which leads to better GPUs which leads to smarter AI.', 'hasDescription': True, 'fullPath': 'subject > science and technology > computer science', 'hasFullPath': True, 'competitionCount': 7, 'datasetCount': 45261, 'scriptCount': 598, 'totalCount': 45866}]",[],[]
